title,company,location,date,link
Infrastructure Engineer,Python Software Foundation,"Remote, USA",19 February 2026,https://www.python.org/jobs/8044/
Software Engineer (Python / Django),Mirvie,"South San Francisco, CA, United States",17 February 2026,https://www.python.org/jobs/8043/
Senior Python Engineer (backend focused),World Parts Direct,"Garland, TX, United States",12 February 2026,https://www.python.org/jobs/8041/
"DevOps Engineer-FULLY REMOTE-US, CANADA, EUROPE only","ActivePrime, Inc.","Mountain View, California, United States",09 February 2026,https://www.python.org/jobs/8040/
Senior Back-End Python Engineer - FULLY REMOTE-WORLDWIDE,"ActivePrime, Inc.","Mountain View, California, United States",09 February 2026,https://www.python.org/jobs/8039/
Senior Full-Stack Engineer (remote),AIDAR,"Hamburg, Germany",30 January 2026,https://www.python.org/jobs/8033/
Junior Software Engineer,Mechanize,"San Francisco, CA, USA",28 January 2026,https://www.python.org/jobs/8032/
Junior Full Stack Developer,Patrick J. McGovern Foundation,"Remote, Remote, United States",28 January 2026,https://www.python.org/jobs/8031/
Senior Python Backend Developer,SKYCATCHFIRE,"Canton, OH, USA",19 January 2026,https://www.python.org/jobs/8030/
Senior Software Engineer,Aquent,"Fully remote, East Coast Preferred, United States",15 January 2026,https://www.python.org/jobs/8027/
Senior Data Privacy Software Developer,OpenDP / Harvard University,"Cambridge, Massachusetts, United States",09 January 2026,https://www.python.org/jobs/8025/
Senior Backend Python Developer,Kanmalai Technologies,"Bengaluru, Karnataka, India",08 January 2026,https://www.python.org/jobs/8024/
Senior Python Developer,Cial Dun & Bradstreet,"São Paulo, São  Paulo, Brazil",22 December 2025,https://www.python.org/jobs/8019/
"Developer, Senior",Illumen Group Inc.,"Bethesda, Maryland, United States",19 December 2025,https://www.python.org/jobs/8016/
Founding Full-Stack Senior Engineer (UK ONLY) - Fully Remote,MyDataValue,"London, ---, United Kingdom",11 December 2025,https://www.python.org/jobs/8014/
AI Engineer,Adaptify,"Remote, Remote, United Kingdom",10 December 2025,https://www.python.org/jobs/8013/
"Director, Ratings AI",Fitch Ratings,"Toronto, Ontario, Canada",05 December 2025,https://www.python.org/jobs/8011/
Python / Django Developer,Client of Foxley Talent,"Remote, United States",01 December 2025,https://www.python.org/jobs/8010/
Staff Software Engineer,Bluebird Kids Health,"Boston, MA, United States of America",24 November 2025,https://www.python.org/jobs/8009/
